{
  "$schema": "./schema/teams.schema.json",
  "version": "1.0.0",
  "description": "AutoGen-style agent teams for orchestrated multi-agent collaboration",
  "lastUpdated": "2024-12-31",

  "teamPatterns": {
    "hierarchical": "Lead agent coordinates, delegates to specialists, aggregates results",
    "round-robin": "Agents take turns contributing, each building on previous",
    "broadcast": "Lead broadcasts task, all agents work in parallel, results merged",
    "debate": "Agents argue positions, vote on best approach, consensus required",
    "pipeline": "Sequential handoff, each agent transforms and passes forward",
    "swarm": "Dynamic self-organization, agents claim tasks based on capability"
  },

  "teams": {
    "code-strike": {
      "name": "Code Strike Team",
      "callsign": "STRIKE-1",
      "purpose": "Rapid feature development with built-in architecture review and testing",
      "pattern": "hierarchical",
      "faction": "Promethean",
      "lead": {
        "callsign": "Genesis",
        "agent": "feature-dev",
        "role": "Coordinates feature implementation, delegates to specialists"
      },
      "members": [
        {"callsign": "Blueprint", "agent": "code-architect", "role": "System design and architecture decisions"},
        {"callsign": "Cortex", "agent": "ai-engineer", "role": "AI/ML implementation when needed"},
        {"callsign": "Nexus", "agent": "api-integration-specialist", "role": "API design and integration"},
        {"callsign": "Falcon", "agent": "vitest-specialist", "role": "Unit and integration testing"},
        {"callsign": "Scrutineer", "agent": "code-review-assistant", "role": "Code quality review"},
        {"callsign": "Veritas", "agent": "double-check", "role": "Final verification"}
      ],
      "triggers": ["implement feature", "build new", "add functionality", "create component"],
      "workflow": {
        "phases": ["design", "implement", "test", "review", "verify"],
        "handoffs": {
          "design": ["Blueprint"],
          "implement": ["Genesis", "Cortex", "Nexus"],
          "test": ["Falcon"],
          "review": ["Scrutineer"],
          "verify": ["Veritas"]
        }
      },
      "capabilities": ["feature-development", "architecture", "testing", "code-review"]
    },

    "quality-council": {
      "name": "Quality Council",
      "callsign": "COUNCIL-Q",
      "purpose": "Comprehensive quality assurance and code review tribunal",
      "pattern": "debate",
      "faction": "Mixed",
      "lead": {
        "callsign": "Paramount",
        "agent": "ceo-quality-controller-agent",
        "role": "Final quality arbiter, breaks ties, sets standards"
      },
      "members": [
        {"callsign": "Magistrate", "agent": "code-reviewer", "role": "Code standards enforcement"},
        {"callsign": "Inspector", "agent": "qa-ticket-reviewer", "role": "QA checklist validation"},
        {"callsign": "Bulwark", "agent": "spec-validator", "role": "Specification compliance"},
        {"callsign": "The Ethereal", "agent": "coverage-analyzer", "role": "Test coverage analysis"},
        {"callsign": "Diagnostician", "agent": "test-results-analyzer", "role": "Test result interpretation"},
        {"callsign": "Polisher", "agent": "quality-enhancer", "role": "Quality improvement suggestions"}
      ],
      "triggers": ["review code", "quality check", "audit", "approve PR", "gate check"],
      "workflow": {
        "phases": ["analyze", "debate", "vote", "verdict"],
        "quorum": 4,
        "consensusRequired": 0.66
      },
      "capabilities": ["code-review", "quality-assurance", "compliance", "coverage-analysis"]
    },

    "debug-squadron": {
      "name": "Debug Squadron",
      "callsign": "DEBUG-1",
      "purpose": "Rapid bug detection, root cause analysis, and fix implementation",
      "pattern": "pipeline",
      "faction": "Spartan",
      "lead": {
        "callsign": "Sleuth",
        "agent": "bug-detective",
        "role": "Lead investigator, hypothesis generation"
      },
      "members": [
        {"callsign": "Tracer", "agent": "debug-session", "role": "Execution tracing and state inspection"},
        {"callsign": "The Illuminant", "agent": "error-analyzer", "role": "Error pattern recognition"},
        {"callsign": "Prism", "agent": "refractor", "role": "Code path analysis"},
        {"callsign": "Patcher", "agent": "bug-fix", "role": "Fix implementation"},
        {"callsign": "Mender", "agent": "test-writer-fixer", "role": "Regression test creation"},
        {"callsign": "Resolver", "agent": "fix-pr", "role": "PR preparation and CI fixes"}
      ],
      "triggers": ["debug", "fix bug", "error", "failing test", "investigate", "root cause"],
      "workflow": {
        "phases": ["detect", "trace", "analyze", "hypothesize", "fix", "verify"],
        "handoffs": {
          "detect": ["Sleuth", "The Illuminant"],
          "trace": ["Tracer"],
          "analyze": ["Prism"],
          "hypothesize": ["Sleuth"],
          "fix": ["Patcher"],
          "verify": ["Mender", "Resolver"]
        }
      },
      "capabilities": ["debugging", "root-cause-analysis", "fix-implementation", "regression-testing"]
    },

    "ship-crew": {
      "name": "Ship Crew",
      "callsign": "SHIP-1",
      "purpose": "End-to-end deployment pipeline from commit to production",
      "pattern": "pipeline",
      "faction": "Spartan",
      "lead": {
        "callsign": "Launcher",
        "agent": "project-shipper",
        "role": "Deployment orchestration and go/no-go decisions"
      },
      "members": [
        {"callsign": "Chronicler-Prime", "agent": "commit", "role": "Git operations and commit management"},
        {"callsign": "Navigator", "agent": "helm-chart-developer", "role": "Helm chart preparation"},
        {"callsign": "Quartermaster", "agent": "helm-release-manager", "role": "Release management"},
        {"callsign": "Orchestrator-Prime", "agent": "k8s-architect", "role": "Kubernetes deployment"},
        {"callsign": "Beacon", "agent": "deployment-tracker", "role": "Deployment monitoring"},
        {"callsign": "Configurator", "agent": "helm-values-manager", "role": "Environment configuration"}
      ],
      "triggers": ["deploy", "ship", "release", "push to prod", "helm upgrade", "rollout"],
      "workflow": {
        "phases": ["prepare", "configure", "deploy", "verify", "announce"],
        "gates": {
          "pre-deploy": ["tests-pass", "review-approved", "security-scan"],
          "post-deploy": ["health-check", "smoke-test", "rollback-ready"]
        }
      },
      "capabilities": ["deployment", "helm", "kubernetes", "release-management"]
    },

    "documentation-guild": {
      "name": "Documentation Guild",
      "callsign": "DOCS-1",
      "purpose": "Comprehensive documentation creation and maintenance",
      "pattern": "broadcast",
      "faction": "Forerunner",
      "lead": {
        "callsign": "Archivist",
        "agent": "codebase-documenter",
        "role": "Documentation strategy and synthesis"
      },
      "members": [
        {"callsign": "Scrivener", "agent": "documentation-writer", "role": "Technical writing"},
        {"callsign": "Surveyor", "agent": "analyze-codebase", "role": "Codebase analysis for docs"},
        {"callsign": "Publisher", "agent": "confluence-documentation-creator", "role": "Confluence publishing"},
        {"callsign": "Retriever", "agent": "context7-docs-fetcher", "role": "External docs research"},
        {"callsign": "Librarian", "agent": "confluence-manager", "role": "Documentation organization"},
        {"callsign": "Scriptor", "agent": "generate-api-docs", "role": "API documentation"}
      ],
      "triggers": ["document", "write docs", "update readme", "api docs", "confluence"],
      "workflow": {
        "phases": ["analyze", "draft", "review", "publish", "index"],
        "outputs": ["README.md", "API docs", "Architecture docs", "Confluence pages"]
      },
      "capabilities": ["documentation", "technical-writing", "api-docs", "confluence"]
    },

    "security-tribunal": {
      "name": "Security Tribunal",
      "callsign": "SEC-1",
      "purpose": "Security review, vulnerability assessment, and compliance verification",
      "pattern": "debate",
      "faction": "Mixed",
      "lead": {
        "callsign": "Bastion",
        "agent": "security-guidance",
        "role": "Security strategy and final verdict"
      },
      "members": [
        {"callsign": "Sentinel-Enterprise", "agent": "enterprise-security-reviewer", "role": "Enterprise security review"},
        {"callsign": "Custodian", "agent": "data-privacy-engineer", "role": "Data privacy assessment"},
        {"callsign": "Ethicist", "agent": "ai-ethics-governance-specialist", "role": "AI ethics review"},
        {"callsign": "Guardian-K8s", "agent": "k8s-security-specialist", "role": "Kubernetes security"},
        {"callsign": "Auditor-Prime", "agent": "legal-compliance-checker", "role": "Compliance verification"},
        {"callsign": "Counselor", "agent": "legal-advisor", "role": "Legal implications"}
      ],
      "triggers": ["security review", "vulnerability", "audit", "compliance", "penetration test", "threat model"],
      "workflow": {
        "phases": ["scan", "analyze", "assess", "debate", "verdict", "remediate"],
        "severityLevels": ["critical", "high", "medium", "low", "informational"],
        "requiredForMerge": true
      },
      "capabilities": ["security-review", "vulnerability-assessment", "compliance", "threat-modeling"]
    },

    "mobile-force": {
      "name": "Mobile Force",
      "callsign": "MOBILE-1",
      "purpose": "Cross-platform mobile development and optimization",
      "pattern": "hierarchical",
      "faction": "Promethean",
      "lead": {
        "callsign": "Hybrid-Prime",
        "agent": "react-native-specialist",
        "role": "Cross-platform strategy and coordination"
      },
      "members": [